{
  "contract_version": "1.0",
  "commit": "0123456789abcdef0123456789abcdef01234567",
  "generated": "2026-10-13",
  "results": {
    "tests/test_config.py": "pass",
    "tests/test_contract.py::C01Tests::test_valid": "pass",
    "tests/test_gate.py::test_slow": "skip",
    "tests/test_old.py": "fail"
  }
}
